id,source,created_at,rating,text
408, facebook, 2025-11-30, none, "A little buggy but I have used Embrace for almost 5 years for 2 pups Quick turnaround after review and reimbursements by direct deposit with no issues"
409, facebook, 2025-11-04, none, "Embrace has been wonderful but premium increases have been steep and I may have to switch even though they have covered more than expected and customer service has been great Long term I cannot afford the increases"
410, facebook, 2025-11-04, none, "I have Embrace for my 12 year old and had it for my dog who passed from lymphoma They paid everything during a year of chemo Treatment cost around 20000 Prices increased a lot at ages 10 to 11 but it was worth it"
411, facebook, 2025-09-12, none, "I have had Embrace for 16 years and 3 pets They are dependable They do not reimburse vets directly but the app makes claims easy when it works Customer service is helpful Be careful signing up a dog who has seen a vet before as anything prior will be pre existing Premiums rise a lot and I had to choose a larger deductible I have a puppy now and will not sign up with Embrace again"
412, facebook, 2025-09-12, none, "I have had Embrace for 2 years and they have been amazing and covered more than expected but premiums have increased a lot forcing me to consider switching My pup is only 4 and healthy but costs rose from 58 to 78 to 109 in two years Coverage is great but increases are steep"
413, facebook, 2025-09-12, none, "I have loved Embrace for over 12 years My two newest pups were insured immediately Premium went from around 110 to 130 for both which is not bad They have covered every claim submitted and reimbursed over 100000 in 12 years Support is friendly and no complaints"
414, facebook, 2025-09-12, none, "I pay 125 for each of my 4 year old mini schnauzers in NY Easy to use app quick reimbursement and my plan covers office visits and prescriptions I am happy with Embrace"
415, facebook, 2025-09-12, none, "I am generally happy with Embrace They have covered a lot and the app is easy to use submit invoice only no extra notes Payment has been fast I have had them for 4 years and increases were not bad until this year which was around 44 percent for my three dogs"
416, facebook, 2025-09-12, none, "I have Embrace and they pay claims quickly Only complaint is the price has gone up significantly but I think all insurance companies do"
417, trust_pilot, 2025-11-29, 5, "It did take a while to get my first claim completed but once completed funds were in my account the next day"
418, trust_pilot, 2025-11-28, 1, "Too much back and forth to get a simple claim paid in a timely manner Question after question Needed proof that I canceled a previous policy from a different carrier which should not matter I also received a note about pre existing condition After several messages it finally went through Everyone I spoke with was nice but I was frustrated and almost canceled Hopefully things will now go smoother"
419, trust_pilot, 2025-11-28, 1, "I have been a client since 2018 for my 3 dogs and was happy at first but premiums have increased rapidly and exponentially Mine went up over 400 a month for next year and they are essentially forcing me out Would not recommend"
420, trust_pilot, 2025-11-26, 1, "Medical documents were submitted as requested along with amended notes I did not receive full reimbursement due to a pre existing diagnosis according to the adjuster I had to resend physician notes and am waiting for review It takes too long to receive reimbursement"
421, reddit, 2025-11-03, none, "I have been researching embrace for cat insurance and the coverage looks good It covers accidents illnesses dental work diagnostic fees and even unlimited reimbursement options They handle claims in about 10 to 15 days and have extras that can help save money over time"
422, reddit, 2025-11-07, none, "I have had 4 cats covered and now only 1 left I used to recommend them but rates have gone through the roof so I do not anymore It seems to be happening everywhere but it has soured me on them"
423, reddit, 2025-11-01, none, "I used embrace for 13 years and loved them but now I would not They increased my annual premium for my 15 year old chihuahua from 2K to 10K even with a multiple dog discount My max payout is 10K so we are effectively being kicked off They say the state sets rates and vet care costs are up but they did not go up 5x in a year I am taking my younger dog off and switching to lemonade"
424, reddit, 2025-11-01, none, "I had the same bad experience earlier this year I do not understand how this can be legal"
425, reddit, 2025-11-07, none, "The same thing is happening to me Embrace wants to charge 4500 for 5000 of coverage for my dog turning 12 My monthly premium is more than doubling"
426, reddit, 2025-11-06, none, "I just canceled my illness insurance because the numbers stopped making sense 200 a month for a 12 year old pug with 1000 deductible 5000 max payout and several pre existing conditions They even denied a 3000 dental due to tarter being noted 4 years ago What a scam"
427, reddit, 2025-11-01, none, "I am experiencing the same thing with embrace My renewal is outrageous"
428, reddit, 2025-11-02, none, "I have had them a long time and they only did a tiny payout once They doubled my cats cost this year I cannot switch due to pre existing condition The whole insurance industry is collapsing"
429, reddit, 2025-11-03, none, "We have had embrace almost the entirety of our 12 year old huskys life Premium was 1K per year and last year was 1331 but next year it will be 3736 a 180 percent increase"
430, reddit, 2025-11-03, none, "My policy is also skyrocketing by end of year increasing 264 percent My dog just turned 8 and is healthy I am switching"
431, reddit, 2025-11-04, none, "My renewal went down from 65 a month to 52 and I did not change my policy I live in California and only submitted dental this year"
432, reddit, 2025-11-04, none, "It is happening across the board My small dog is turning 12 and her monthly premium is more than doubling We will not renew"
433, reddit, 2025-11-26, none, "I just received notice of a 400 percent premium increase for my cats I broke even due to a big claim last year Good riddance"
434, reddit, 2025-11-26, none, "I got hit with a 300 percent increase and with a 10000 accident maximum Went from 570 to 1751 My dog is 7 with no serious issues This is insane"
435, reddit, 2025-11-02, none, "I have had embrace for many years for my cat and dog My dog has health issues now considered pre existing and wont be covered if I switch My cat barely uses the policy but my renewal is a 125 percent increase making it unaffordable I am backed into a corner and think it is unethical"
436, reddit, 2025-11-11, none, "My policy is going up by over 130 percent It is completely unaffordable and was already expensive I do not know what to do"
437, reddit, 2025-11-07, none, "Embrace is excellent I took it out on my 7 year old"
438, reddit, 2025-11-15, none, "On allstate they just sell you a policy through embrace Depending on your state embrace has been jacking up premiums and may penalize you for making claims It would not be my first choice anymore"
439,trust_pilot,2025-12-13,1,They are a scam They keep giving us the runaround and refuse to pay our one claim we have ever had They repeatedly ask for more medical records and I have had to call them repeatedly Still nothing This company is a scam
440,trust_pilot,2025-12-13,5,I never expected such a smooth and easy process when I submitted my first claims The claims were processed and approved the same day Never expected a hassle free experience Thank you Embrace
441,trust_pilot,2025-12-13,5,Came through when needed I am now not in debt nine grand because I purchased an embrace plan
442,trust_pilot,2025-12-13,5,This was our first time processing a claim The process was fast and easy The first claim was approved in just a few days Teeth cleaning and one extraction Shortly after we had several ear infection visits and all were processed timely Very satisfied
443,trust_pilot,2025-12-11,1,Horrible Stay away from this company at all costs They find ways to avoid paying by calling everything pre existing I paid almost ten thousand dollars at emergency vet and was reimbursed nothing
444,trust_pilot,2025-12-10,1,Raising rates to excess Paid for seven years Once you need to use it they raise rates excessively You cannot switch because everything becomes pre existing Terrible experience Beware
445,trust_pilot,2025-12-09,5,Good experience with first claim Embrace communicated status well and reimbursed quickly once approved Filing process was very easy
446,trust_pilot,2025-12-08,1,Sadly I have to give one star otherwise zero Due to a stroke we tried to cancel the policy Emails were ignored Charges continued and we lost access This was an awful experience
447,trust_pilot,2025-12-08,5,Excellent app and service Very easy to use app for filing and tracking claims with very fast response
448,trust_pilot,2025-12-07,1,Stay away from I had a policy for two years First year all claims denied Second year only one claim covered Then premium tripled after a payout Cancelled immediately
449,trust_pilot,2025-12-07,5,Everything is done very quickly and professionally
450,trust_pilot,2025-12-07,5,Everyone was so helpful and kind They looked into the situation and fixed everything
451,trust_pilot,2025-12-06,5,Quick and easy claims experience Filing was fast payment arrived promptly No hassle
452,trust_pilot,2025-12-05,5,It did take a while to get my first claim completed but once completed funds were in my account the next day
453,trust_pilot,2025-12-05,1,Too much back and forth for a simple claim Proof requested repeatedly including canceled prior policy Eventually approved but very frustrating
454,trust_pilot,2025-12-04,1,Premiums increased exponentially after years as a customer Increase of over four hundred dollars per month Forced out Would not recommend
455,trust_pilot,2025-12-03,1,Medical documents not read thoroughly Partial reimbursement due to pre existing condition Had to resend physician notes Review process taking too long
456,trust_pilot,2025-12-03,5,If only people health insurance worked this fast Submitting a claim was fast and easy Reimbursed within days
457,trust_pilot,2025-12-02,5,Easiest and fastest experience submitting a claim Took under five minutes and approved in less than an hour
458,google_play,2025-12-12,5,Super easy to submit claim and always has great customer service when needed
459,google_play,2025-12-12,5,Best decision I have ever made Affordable pricing I have had four pets insured by them Great people to work with Dont know what I would do without them
460,google_play,2025-12-12,5,Very easy to use
461,google_play,2025-12-09,4,Claims are very speedy I own a yellow lab
462,google_play,2025-12-08,5,No complaints here
463,google_play,2025-12-08,5,Embrace pet insurance app is one of the quickest ways to make a claim for your pets and get results faster
464,google_play,2025-12-06,3,Keeps freezing or acting wonky when trying to submit a claim Only allows picture uploads not file documents
465,google_play,2025-12-05,1,I love Embrace pet insurance but the app is horrible It keeps closing when submitting a claim and has not been fixed in years
466,google_play,2025-12-03,5,Submitting a claim on the Embrace app is super easy and efficient
467,google_play,2025-12-02,5,Easy to submit claims Fast processing and reliable reimbursements
468,google_play,2025-12-01,2,The app is very unoptimized for mobile devices
469,app_store,2025-12-11,5,The Embrace representative on the phone could not have been more helpful She provided comfort and assistance after we had to put down our dog earlier in the day and also helped with the claim due to computer issues
470,app_store,2025-12-10,1,Very pessimistic about the service and communication Did not provide fast solutions for claims and I canceled the policy
471,app_store,2025-12-09,5,The best pet insurance I recommend to all pet owners
472,app_store,2025-12-09,5,This was my first claim for a wellness visit The process was extremely fast and easy I hope the reimbursement is just as fast
473,app_store,2025-12-05,1,We have had this insurance for three years and Embrace has yet to pay for anything We pay monthly and receive nothing I feel ripped off
474,app_store,2025-12-02,1,A claim was submitted via email and confirmed received but never appeared in my account Multiple calls and long hold times Nearly two hundred per month is ridiculous
475,app_store,2025-11-30,1,Embrace has yet to pay any claim and I have been with them for years They keep asking for the same information repeatedly
476,app_store,2025-11-29,1,Embrace is no longer the company it once was Excessive document requests poor communication and a badly designed portal
477,trust_pilot,2025-12-23,1,Do not ignore the warning signs Embrace Pet Insurance is close to a scam while remaining legal Claims are denied through excessive paperwork vague notes turned into pre existing conditions and legal language used to justify denials I canceled my policy and regret the premiums paid
478,trust_pilot,2025-12-23,4,Mostly positive experiences with claims but the submission process is glitchy and annoying
479,trust_pilot,2025-12-23,5,Embrace is generally easy to work with for submitting claims and customer service is almost always polite respectful and helpful
480,trust_pilot,2025-12-22,1,This company uses unethical loopholes to deny coverage Conditions that develop while insured are later labeled pre existing if coverage is adjusted This traps customers in policies I canceled all policies and would never recommend them
481,trust_pilot,2025-12-22,1,Embrace was reliable early but became unaffordable as my cat aged Premiums doubled benefits were removed and I was unable to adjust coverage without triggering exclusions My cat is now uninsured
482,trust_pilot,2025-12-22,1,Claims were stalled for ten months through repeated documentation requests I am switching companies after extreme frustration
483,trust_pilot,2025-12-21,4,Very caring and professional service when managing a pets illness or injury
484,trust_pilot,2025-12-21,2,After six years as a customer moving locations caused an eighty five percent premium increase Claims were easy but customer service felt scripted
485,trust_pilot,2025-12-21,1,Never received reimbursement despite repeated follow ups and excessive effort Still unresolved
486,trust_pilot,2025-12-21,5,Claims are resolved quickly reimbursements are fast and staff corrected a filing error themselves Friendly and helpful representatives
487,trust_pilot,2025-12-21,5,Embrace has always been helpful responsive and timely with claims
488,trust_pilot,2025-12-20,1,Claim was denied by equating a tumor with allergies Communication delays and lack of follow up led to extreme frustration
489,trust_pilot,2025-12-20,1,Embrace will attempt to avoid paying claims Normal incidents are labeled pre existing This insurance is not worth the cost
490,trust_pilot,2025-12-19,3,Claims reviews feel slow and documentation requests are burdensome especially for older adopted dogs
491,trust_pilot,2025-12-19,5,Customer service was extremely kind helpful and explained next steps clearly during my first call
492,trust_pilot,2025-12-19,2,Long term customer disappointed by claim denial based on old dental notes despite prior positive history
493,trust_pilot,2025-12-19,1,Accident coverage information was inconsistent claims denied and multiple exclusions added I canceled my policy
494,trust_pilot,2025-12-18,4,The process took longer than expected but the outcome was positive
495,trust_pilot,2025-12-18,5,A large bill was covered immediately and the company stood behind their product
496,trust_pilot,2025-12-18,1,Premium nearly doubled without claims making the policy unaffordable Long term customers face extreme renewal increases
497,trust_pilot,2025-12-26,3,Waiting almost three months for claim review After providing all requested documentation to rule out pre existing conditions there is still no response Phone support wait times exceed thirty minutes and the website frequently glitches I am waiting to see how the claim is resolved
498,trust_pilot,2025-12-26,1,Slow administration no proactive follow up and overly broad determination of pre existing conditions Very disappointed and do not understand why this company is rated highly
499,trust_pilot,2025-12-25,5,Embrace was easy to work with and very supportive when my cat passed away Claims were paid promptly and I received an unexpected prorated refund when removing coverage
500,trust_pilot,2025-12-24,3,Renewal premium doubled for a dog with no recent claims New customer quote was far lower Support could not clearly explain the discrepancy Service otherwise has been good
501,trust_pilot,2025-12-24,5,Always helpful and friendly
502,trust_pilot,2025-12-24,5,Website is easy to use Pre authorization was approved quickly and reimbursement arrived within two days Excellent experience
503,app_store,2025-12-25,5,"The submission of claims is simple and quick to do on your phone Reimbursement is just as easy for qualified claims My dog is still alive because of Embrace You cannot go wrong with them"
504,app_store,2025-12-22,5,"Very happy with Embrace for my dogs health insurance The app is easy to use and claims have been easy to process and quickly resolved Highly recommend"
505,app_store,2025-12-22,4,"App UI should allow uploading PDF documents instead of only photos That would be a great improvement"
506,app_store,2025-12-21,1,"I usually receive vet invoices digitally but the app forces you to take a photo of a paper document and does not allow skipping this step"
507,app_store,2025-12-20,1,"Diagnosis options are far too limited and make choosing the correct diagnosis very difficult"
508,app_store,2025-12-19,1,"Insurance coverage itself has been solid but the app experience is extremely frustrating The app loads slowly and sometimes does not allow login It often redirects to error pages The app has not been updated in months which shows in performance issues"
509,app_store,2025-12-18,5,"First claim and pleasantly surprised by how easy the process was"
510,app_store,2025-12-15,1,"The Embrace website is not user friendly The login link should be at the top of the page not the bottom"
511,google_play,2025-12-23,5,"Staff is very helpful and reimbursements are quick"
512,google_play,2025-12-23,1,"App tries to crash every step of the way"
513,google_play,2025-12-20,5,"Peace of mind in case there is an emergency"
514,google_play,2025-12-19,3,"App needs to be updated"
515,google_play,2025-12-17,5,"Embrace has always come through for us Very easy to submit claims Great price and coverage"
516,google_play,2025-12-16,2,"App shuts down all the time"
517,google_play,2025-12-12,5,"Super easy to submit claim and always has great customer service when needed"
518,google_play,2025-12-12,5,"Best decision I have ever made Affordable pricing Four pets insured Great people to work with"
519,google_play,2025-12-12,5,"Very easy to use"
520,trust_pilot,2026-01-03,5,Follow up on veterinarian identification was required Company employee was very helpful and that was completed for application
521,trust_pilot,2026-01-02,5,The service that I received was most excellent
522,trust_pilot,2026-01-02,1,My premium went up 60 a month out of the blue 35 percent more than what I was previously paying which was already high They said it is because of inflation Inflation is 8 percent My dog is perfectly healthy and only 6 years old This is highway robbery and I recommend you look elsewhere for pet insurance
523,trust_pilot,2026-01-02,5,My interaction with customer service when I couldnt get the expiration date for billing to change was an easy and pleasant experience as all my interactions with Embrace have been The person who helped me was extremely personable and helpful
524,trust_pilot,2026-01-02,3,I filed three claims at the same time One claim is still pending info from the vet so I wont review that one One claim was reimbursed as expected The other claim was reimbursed at about 20 percent of the total which was much lower than expected I asked why the amount was so low and have not received a response
525,trust_pilot,2026-01-01,5,Once I submitted the requested documents everything was good and quick
526,trust_pilot,2026-01-01,5,Our five year old Aussiedoodle has had his share of claims and Embrace has been a lifesaver to us We were unsure if pet insurance was affordable or necessary but it has proven to be both
527,trust_pilot,2025-12-30,2,I attempted to stop autopay on the website because they raised my upcoming premium significantly The website would not allow me to do it I called and was placed on hold and then emailed requesting action with no response so far
528,trust_pilot,2025-12-29,2,Reviews of medical history are overly general and appear designed to broadly exclude future claims Claims are paid quickly though
529,google_play,2026-01-02,5,Really easy to enrolling very good customer service the app is easy to use and easy to get what we need
530,google_play,2026-01-02,5,Very easy and user friendly to submit claim
531,google_play,2026-01-01,1,Im constantly receiving a message that the app is not responding with the option to close or wait I hit wait so my claims can go through but it pops up many times when trying to do so This has been an ongoing problem for over a year Also the app crashes when trying to upload my invoice and does not allow PDF uploads
532,google_play,2025-12-31,1,The app keeps stopping Submitting this claim has been very frustrating and time wasting
533,google_play,2025-12-31,5,Embrace Pet Insurance has taken good care of Missy and it is an easy to use service
534,google_play,2025-12-29,none,Submitting my invoice was very easy
535,app_store,2025-12-31,1,Just like every other insurance company out there it is a scam They deny you until you push back and then maybe they will pay Insurance is a business and is a legal money making scam operation
536,app_store,2025-12-30,5,Please add the ability to load documents instead of pictures
537,app_store,2025-12-30,5,Easy to use app and submit a claim
538,app_store,2025-12-29,5,So far my experience with embrace has been good Service is friendly and efficient
539,trust_pilot,2026-01-09,1,Embrace is bad business My dogs were covered with Embrace twice and the second time I filed a claim it was denied due to not having an ortho exam on file I was told the exam was not needed since I had a previous policy They denied my claim said my oldest dogs condition was preexisting and left him in a holding pattern I pay more for pet insurance than Medicare and was lied to with no follow up Buyer beware My review stands Embrace contradicted themselves by email and I would never recommend them
540,trust_pilot,2026-01-09,2,Very easy to enroll but difficult to collect I had one claim and they kept finding reasons not to pay until renewal time when suddenly it was approved Policies also get very expensive as pets get older
541,trust_pilot,2026-01-08,5,They have been great insurance for my Yorkies with quick reimbursement clear explanations and great telephone support
542,trust_pilot,2026-01-08,5,Really exceptional customer service every single time
543,trust_pilot,2026-01-07,1,I have had this policy for my two dogs for four years One dog had an abscess hole in his face requiring surgery and tooth removal They denied the claim saying it was routine dental cleaning It was not After months of back and forth and over five thousand paid in premiums I cancelled and would not recommend them
544,trust_pilot,2026-01-06,5,Originally had a problem with my claim but after talking with them it was resolved Fair people willing to listen and recommend
545,trust_pilot,2026-01-06,5,Embrace Pet Insurance is amazing especially their customer service Thank you for helping me and insuring my cat
546,trust_pilot,2026-01-05,5,The process was simple and fast I appreciate the quick turnaround and support during my time of need
547,trust_pilot,2026-01-05,1,Complete waste of money My cat was diagnosed with IBD and nothing digestive is covered due to one vomiting instance before policy start They covered nothing and cancelling was difficult Total scam
548,trust_pilot,2026-01-05,1,Embrace wanted me to resubmit an invoice due to cropping issues caused by their system Customer service was repetitive unhelpful and put me on hold I am done
549,trust_pilot,2026-01-04,5,Filing a claim is easy directions are clear and legitimate claims are paid quickly
550,trust_pilot,2026-01-04,2,Premiums have skyrocketed and the website fails when trying to get a quote Higher cost and less service
551,app_store,2026-01-09,1,Love the insurance hate the app The app completely shuts down and closes every time I try to log in despite restarting my phone and deleting and reinstalling the app
552,app_store,2026-01-09,5,I have had them for a little over a year now and they are great
553,reddit,2026-01-11,none,I would not get Embrace They increase prices based on how long pets have been insured and for having claims
554,reddit,2026-01-10,none,Embrace just hiked my dogs premium from 1365 to 2889 which feels unreasonable for a 12 year old husky Looking for alternative insurance recommendations
555,reddit,2026-01-09,none,Embrace is doubling my premium from 122 to 213 despite USAA discounts Multiple pets no preexisting conditions Looking for other company suggestions
556,reddit,2026-01-09,none,They doubled my premium from 150 to 300 per month despite minimal claims Switched to Figo for better coverage and lower cost and will cancel Embrace
557,reddit,2026-01-04,none,Currently have Embrace but considering MetLife due to similar cost better reviews and no loss no gain coverage
