id,source,created_at,rating,text
1004,trust_pilot,2025-09-24,5,Easy claim submission Fast review Quick payout Invoices need to be for a single pet at a time but smooth once known
1005,trust_pilot,2025-09-22,5,Easy to submit claim Few questions Photo of invoice and done
1006,trust_pilot,2025-09-21,2,Website difficult for claim submission Selecting provider or date takes multiple attempts Extremely frustrating
1007,trust_pilot,2025-09-21,5,Easy document submission
1008,trust_pilot,2025-09-21,5,Initially considered canceling after poor first rep Gave another chance Since then exceptional service Very pleased
1009,trust_pilot,2025-09-21,5,Monique went above and beyond Valuable problem solving skills Thankful
1010,trust_pilot,2025-09-21,5,So easy Loves the experience
1011,trust_pilot,2025-09-20,5,Amazing insurance Nice helpful customer service Dog had meningoencephalitis and seizures Hospital bill high Reimbursed within 10 days Highly recommend
1012,trust_pilot,2025-09-20,5,Loves Embrace Easy to use Quick resolutions USAA expedited call line
1013,trust_pilot,2025-09-20,5,Called to change premium Kind helpful service Submitted claim after emergency visit ending in euthanasia Received condolences and account closure help
1014,trust_pilot,2025-09-20,5,First claim submitted Excellent customer service Claim paid within three days Very pleased
1015,trust_pilot,2025-09-20,1,Initially denied diagnostic claims for urgent spinal surgery Added pre existing condition after clean history Escalated to executives and regulators eventually paid over 9000 Concerns about post claim underwriting and overbroad exclusions
1016,trust_pilot,2025-09-20,4,Medical info review Thorough and clear
1017,trust_pilot,2025-09-20,5,Very easy claim process Efficient review and reimbursement Easy to work with
1018,trust_pilot,2025-09-19,1,Claim stuck pending medical records for over three weeks despite documents sent Canceled Terrible experience
1019,trust_pilot,2025-09-19,5,Easy claim submission Quick response Great overall service
1020,trust_pilot,2025-09-19,5,Friendly knowledgeable associates Easy to submit claims
1021,trust_pilot,2025-09-19,5,Insured since 2021 Helped cover surgeries Peace of mind Enables treatment decisions without cost pressure
1022,trust_pilot,2025-09-19,5,Easy online claim process Suggests email reminders for wellness claim anniversary date
1023,trust_pilot,2025-09-19,1,Reimbursement took three months Repeated requests for prior vet visits Claims handling felt inattentive
1024,trust_pilot,2025-09-19,5,Appreciated support during pet passing Timely courteous Expedited coordination with vet and hospital Claim settled Not fully agreed but understood outcome
1025,trust_pilot,2025-09-19,5,Friendly helpful customer service rep Lexi Answered questions Resolved billing or reimbursement discrepancies Corrected issues and sent missing reimbursements Would recommend
1026,trust_pilot,2025-09-19,5,Easy to fill out and submit claim
1027,trust_pilot,2025-09-19,3,Claims take 30 plus days and longer to pay Questions why providers cannot file directly Believes delays discourage claims
1028,trust_pilot,2025-09-19,5,Very easy claims submission Fast review process Has not met deductible yet but pleased so far
1029,trust_pilot,2025-09-19,5,Morgan was professional and very helpful
1030,trust_pilot,2025-09-19,5,Four claims in one month for infections and surgery Took two tries to submit docs correctly Once received processed in a few days Direct deposit received quickly
1031,trust_pilot,2025-09-18,5,Enjoyed benefits for Bonz so far
1032,trust_pilot,2025-09-18,1,Claims denied despite vet and specialist letters stating injuries not pre existing Submitted thorough documentation Canceled policy Left with thousands in expenses
1033,trust_pilot,2025-09-18,5,Dog had perianal fistula Treated for a year then surgery Embrace quickly paid claims Very satisfied and recommends
1034,trust_pilot,2025-09-18,5,Simple intuitive claim process Prompt responses Clear EOB With Embrace over 4 years No need to appeal Claims seamless
1035,trust_pilot,2025-09-18,5,Easy to use and good customer service
1036,trust_pilot,2025-09-18,5,With Embrace for 18 years Fair Easy claims Fast reimbursements Direct deposit convenient
1037,trust_pilot,2025-09-18,5,Highly recommends Embrace Knowledgeable helpful agents
1038,trust_pilot,2025-09-18,1,Waste of money Says they never pay claims
1039,trust_pilot,2025-09-18,5,First claim Missing pre insurance records Embrace helped gather old and new paperwork Did not deny claim Processed quickly
1040,trust_pilot,2025-09-18,5,Westley Smith was knowledgeable Laid out plan details Positive experience
1041,trust_pilot,2025-09-17,1,Long hold times Customer service took 20 minutes to answer
1042,trust_pilot,2025-09-17,3,Premiums increased to 120 per month for two dogs Claims denied previously and most recent paid less than half after 250 deductible Dissatisfied value
1043,trust_pilot,2025-09-17,5,Claims process foolproof Response time exceptional Very satisfied
1044,trust_pilot,2025-09-17,5,Previous emergency injury and surgery claims processed faster than expected Current follow up claim submitted Positive experience
1045,trust_pilot,2025-09-17,5,Easy to submit claims
1046,trust_pilot,2025-09-17,1,Wellness Rewards keeps unused contributions if not used within policy year Feels misleading No warning except verbal Says over 200 lost Canceled policy
1047,trust_pilot,2025-09-17,5,Claim handled within 72 hours Extremely fast compared to other insurers
1048,trust_pilot,2025-09-17,5,Ease of filing claim excellent Direct deposit bonus
1049,trust_pilot,2025-09-17,5,Very easy to submit claim Very quick response
1050,trust_pilot,2025-09-16,5,Easy to upload and submit claims Reimbursed quickly Claims run smoothly
1051,trust_pilot,2025-09-16,4,Easy to use Fast
1052,trust_pilot,2025-09-16,1,Claims denied due to filing deadline Held receipts for year Policy renewed Says services were covered Should be no time limit
1053,trust_pilot,2025-09-16,5,Claim process easy Customer service pleasant Answered questions Recommends to other pet parents
1054,trust_pilot,2025-09-16,5,Online claim submission easy straightforward Compliments design Waiting for reimbursement
1055,trust_pilot,2025-09-16,5,My kitties are in good hands
1056,trust_pilot,2025-09-16,5,Super easy to use
1057,trust_pilot,2025-09-15,4,Quick painless claims process Great experience but premium increased over 56 percent Feels punished for using insurance
1058,trust_pilot,2025-09-15,5,Easy to make claims Exceptional response time Pays as good or better than most
1059,trust_pilot,2025-09-15,5,Easy claim submission Fast payment processing Clear coverage explanations Wishes human insurance were this easy
1060,trust_pilot,2025-09-15,1,Dog insured 9 years No claims Premium doubled past two years then doubled again to 158 per month Canceled
1061,trust_pilot,2025-09-15,1,Premium set to renew with 68 percent monthly increase Calls pricing algorithms ridiculous Stuck due to pet allergies pre existing condition
1062,trust_pilot,2025-09-15,3,Rather cumbersome process
1063,trust_pilot,2025-09-15,5,Excellent service with kindness during time of sorrow
1064,trust_pilot,2025-09-15,2,Policy increased over ten years from 360 per year to 3600 per year for same coverage Feels excessive despite good customer care Would choose different company No longer recommends
1065,trust_pilot,2025-09-14,5,Embrace is a great company Very happy with them
1066,trust_pilot,2025-09-14,1,Would not recommend Premium price gouging as pet gets older Went from 60 per month to almost 400 per month Heartbroken
1067,trust_pilot,2025-09-14,5,Great customer service Phone reps answer quickly Easy claim submission Reimbursed in 48 to 72 hours Paid almost 9k this year due to dog lymphoma
1068,trust_pilot,2025-09-14,5,Easy to submit claims Reimbursement in account within 3 days Very satisfied
1069,trust_pilot,2025-09-14,5,Representative resolved issue right away
1070,trust_pilot,2025-09-13,5,Embrace is a must Helped cover costly hospitalization Saved finances Highly recommends Will use for every future pet
1071,trust_pilot,2025-09-13,5,Claim submission super easy quick Photo option and dropdown reasons helpful
1072,trust_pilot,2025-09-13,5,User friendly Smooth claims process Clear plan details
1073,trust_pilot,2025-09-13,5,Excellent process Quick payment Received money within 1 to 2 days Expensive but worth it
1074,trust_pilot,2025-09-13,5,Submitting claims is easy Claim paid extremely quick Happy with choice
1075,trust_pilot,2025-09-13,5,Love how easy and quick claim process is Takes minutes Quick review process Loyal to Embrace
1076,trust_pilot,2025-09-15,1,The worst Price gouging Scam Says better options Better prices Better reviews Claims reviews are fake or new customers Premiums double or triple at renewal
1077,trust_pilot,2025-09-12,5,Wellness claim submission was very easy on webpage
1078,trust_pilot,2025-09-12,1,Disgusted rate jump over 200 percent Mentions JAB Holdings acquisition and consolidation Claims aggressive premium increases and denials Says shareholder profit targets drive hikes
1079,trust_pilot,2025-09-12,4,Diagnosis list confusion Osteosarcoma not included Otherwise great
1080,trust_pilot,2025-09-12,5,Embrace through USAA made a difference Wishes had it sooner for past pets
1081,trust_pilot,2025-09-12,1,Used to be decent Now does not respond No one answers phone Claims pending three months Over 1200 in claims none paid Canceling
1082,trust_pilot,2025-09-12,5,Thorough helpful phone support First time using pet insurance in the US Guided through process
1083,trust_pilot,2025-09-12,5,Very easy to submit claim Upload documents Fast turnaround Clear explanation of benefits
1084,trust_pilot,2025-09-12,5,Never a problem Smooth transactions Peace of mind 80 percent reimbursement
1085,trust_pilot,2025-09-12,5,Embrace stands as number one pet insurer in America Complete coverage options Fast turnaround Easy painless transitions
1086,trust_pilot,2025-09-12,1,Predatory company Uses past symptoms like vomiting or diarrhea to deny unrelated claims Calls medical record reviews subjective Claims denials are a business tactic Recommends other providers
1087,trust_pilot,2025-09-12,5,Extremely efficient Claims are easy Status updates provided Great company
1088,trust_pilot,2025-09-12,5,Handles claims quickly Easy to submit
1089,trust_pilot,2025-09-12,5,Claim submissions made easy Quick reimbursements Wishes people insurance was this easy
1090,trust_pilot,2025-09-12,1,Premiums increase every year Pays out less Claims are difficult Paperwork heavy Wait about 30 days even with military discount Cancelled Not worth it for two pets
1091,trust_pilot,2025-09-11,3,Overpriced Pays quickly once you figure out cumbersome site Cannot fax or photo by email Wants future payments four times higher after dog diabetes Says date below not accurate in system
1092,trust_pilot,2025-09-11,5,Very fast processing of claims Recommend Has policy 5 years No reimbursement issues
1093,trust_pilot,2025-09-11,5,USAA made Embrace more affordable Enrollment simple Straightforward Peace of mind Hopes not to need claims
1094,trust_pilot,2025-09-11,5,Great at paying claims Wishes they did people insurance
1095,trust_pilot,2025-09-11,1,Stopped paying medication after 12 years Claims they were wrong previously Disputes vet overdose situation Very upset
1096,trust_pilot,2025-09-11,3,Frustrating and disappointing Claims process slow Effortful Communication unclear Frequent follow up Coverage okay but stressful
1097,trust_pilot,2025-09-11,5,Responsive Settled claim immediately after vet paperwork Happy with insurance Thanks USAA partnership
1098,trust_pilot,2025-09-11,5,Longtime customer nearly 20 years Three dogs Frenchie encephalitis Monthly low dose chemo Prompt reimbursements Within policy limits Life saver
1099,trust_pilot,2025-09-11,5,Great service and claim process Timely Process and explanations well stated
1100,trust_pilot,2025-09-11,5,Great claims process Quick responses Embrace contacts vet for missing info Easy process
1101,trust_pilot,2025-09-11,5,Multiple phone calls needed Agents patient knowledgeable helpful
1102,trust_pilot,2025-09-11,5,Simple claim process
1103,trust_pilot,2025-09-11,5,Never denied a claim Amazing support Will keep and recommend
1104,trust_pilot,2025-09-10,5,Fast and easy A bit pricey but worth it
1105,trust_pilot,2025-09-10,5,Pleased so far Reimbursed majority of many claims within a day or two Premium went up 20-25 dollars Possibly due to claims
1106,trust_pilot,2025-09-10,5,Speedy reimbursements Takes good care of Lily Reimbursements as expected and fast
1107,trust_pilot,2025-09-10,5,Company is awesome Loves plan 90 percent back Answers questions Recommends to everyone with pets
1108,trust_pilot,2025-09-10,5,Seamless and quick claim process Two claims Easy to file Decisions within days Pleased chose Embrace
1109,trust_pilot,2025-09-10,3,Claim for 3200 covered less than half Feels premiums over years would have paid surgery Useless
1110,trust_pilot,2025-09-10,5,Easy to file and quick
1111,trust_pilot,2025-09-10,1,Wants immediate reimbursement Upset about response time even after paperwork submitted
1112,trust_pilot,2025-09-10,5,Easy filing and attaching invoice
1113,trust_pilot,2025-09-10,5,Okay slow to pay
1114,trust_pilot,2025-09-09,2,Beware Thought deductible was per visit and visits under 250 not covered Says insurance has covered nothing
1115,trust_pilot,2025-09-09,5,Excellent service Very helpful Longtime customer Embrace helped keep dog Heyu alive
1116,trust_pilot,2025-09-09,1,Horrible Says they call anything pre existing Vomiting used as condition Extends vomiting exclusion Appealing Owes over 1000 Threatens lawsuit
1117,trust_pilot,2025-09-09,5,Outstanding company Professional efficient friendly Fast claim turnaround Helps aging pet Minkie maintain quality of life 90 percent plan good value
1118,trust_pilot,2025-09-09,2,Not impressed First claim review took full 30 days Rejected then reversed after vet letter Found new exclusion Slow communication Waiting on related claims
1119,trust_pilot,2025-09-09,1,System crashed mid claim submission Raises suspicion of intentional delays
1120,trust_pilot,2025-09-09,5,Sign up was a breeze Agent answered questions Peace of mind after signup
1121,trust_pilot,2025-09-08,5,Excellent customer service Knowledgeable agent Answered questions Prices good
1122,trust_pilot,2025-09-08,4,Good at first Hard to reach customer service Needs login help Long waits calling
1123,trust_pilot,2025-09-08,4,Claim process easy Quick bank return Helpful phone support Website errors often During claim submission Frustrating but alternative submission provided
1124,trust_pilot,2025-09-08,1,Cautionary tale Denied urgent pug claim as pre existing due to six month orthopedic waiting period Appeal denied Feels trapped and misled
1125,trust_pilot,2025-09-08,1,DO NOT USE THIS COMPANY Longtime customer No claims Rates rose from 80 to 130 then to 336 per month Says lowest coverage 160 for basically no coverage Feels priced out Mentions letter saying increase legal in Colorado Calls replies lies
1126,trust_pilot,2025-09-07,1,Poor Not very good insurance
1127,trust_pilot,2025-09-07,5,Super easy online claim process
1128,trust_pilot,2025-09-07,5,Simple to use and straightforward
1129,trust_pilot,2025-09-08,5,Decade highly satisfied Two Australian Shepherds covered 10 years Multiple illnesses and injuries covered Treating osteoarthritis and IVDD Added Labrador puppy Covered from day one Policies clear App easy Claims paid fairly and promptly
1130,trust_pilot,2025-09-08,3,Feels scammed after a decade Premium doubled for oldest cat at renewal Believes linked to recent illness Says stuck due to pre existing rules Claims Embrace punishes for using insurance Update says 200 percent increase 200 to 400 per month
1131,trust_pilot,2025-09-07,5,Never had issues in over 5 years
1132,trust_pilot,2025-09-07,1,Disappointment Missed submitting 2023 claim due to hospitalizations and strokes Asked exception denied Premium rose from 54 to 70 to over 120 Feels lack of compassion
1133,trust_pilot,2025-09-08,2,Exorbitant price increases Rates up 30-40 percent yearly Now 258 percent for two dogs 138.09 to 356.39 One dog up 320 percent when turned 10 Other dog age 4 up 55 percent Says reply not true
1134,trust_pilot,2025-09-07,3,Longtime member 15 plus years Says Embrace great but waiting on promised spreadsheet of charges per dog Needed to choose new policy No help No spreadsheet yet
1135,trust_pilot,2025-09-07,2,Normally fine but portal claim submission failed Had to email Asked repeatedly for diagnosis Resubmitted once portal worked Hopes helps
1136,trust_pilot,2025-09-07,5,Pleasant call with Gary Answered questions Clearly Comfortable buying insurance
1137,trust_pilot,2025-09-08,1,Avoid Embrace Claim denial service Diagnostics denied as pre existing thyroid Blanket denial No itemization Second claim pending medical history despite records Vet asked for itemization Embrace silent Update asserts lack of transparency
1138,trust_pilot,2025-09-06,1,Wont pay claims Four claims three denied as pre existing Premiums raised 38 percent after first year Wanted 1500 for no coverage Cancelled
1139,trust_pilot,2025-09-06,5,Very satisfied Phone help for claim submission due to computer glitch Quick resolution
1140,trust_pilot,2025-09-06,5,Havent had to use yet Unsure about claims or reimbursement
1141,trust_pilot,2025-09-06,1,Read fine print Worst cost Lack of empathy Ties diagnosis back to pre existing to deny
1142,trust_pilot,2025-09-05,5,Great customer service Dog healthy Communications pleasant Responsive Answers policy and billing questions
1143,trust_pilot,2025-09-05,5,Quick turnaround on a claim Thank you
1144,trust_pilot,2025-09-08,5,Rep Taylor knowledgeable Convinced buyer Benefits look good Bought best policy for expensive Maine coon kitten Tasha
1145,trust_pilot,2025-09-05,2,No issue with customer service but company concerns Nine year customer Renewal saw 71 percent rate increase Pets healthy No massive claims Told due to dogs ages Calls it price gouging Renewal for two dogs almost 4000 per year More than vet bills
1146,trust_pilot,2025-09-05,3,App not accessible for visually impaired Screen reader claim submission stops working
1147,trust_pilot,2025-09-04,5,Year of positive experiences Easy and unstressful Preauthorizations for tests helpful
1148,trust_pilot,2025-09-04,5,Excellent customer service Reps keep customer in the information loop
1149,trust_pilot,2025-09-04,5,Great company Easy to navigate website and submit claim
1150,trust_pilot,2025-09-04,5,Best pet insurance Quality service
1151,trust_pilot,2025-09-04,5,Excellent company and fair
1152,trust_pilot,2025-09-04,5,Thank you embrace company and staff
1153,trust_pilot,2025-09-04,5,Cat vet visit Claim form quick and easy Payment in less than a week Loves Embrace
1154,trust_pilot,2025-09-03,2,Too many marketing messages Hundreds of emails and texts first month trying to sell more coverage Hates unsolicited messages
1155,trust_pilot,2025-09-03,5,Life savers Reliable Supportive Customer service welcoming Price good for 2 pets Downside pay out of pocket first but reimbursement quick
1156,trust_pilot,2025-09-03,5,Easy to deal with Friendly Great portal Transparent processing Saved over 20k Multiple emergency eye surgeries and knee procedure Strong pro insurance stance
1157,trust_pilot,2025-09-03,4,So far so good Great way to care for pets
1158,trust_pilot,2025-09-03,3,Claim form repeated error messages Required restarting claims
1159,trust_pilot,2025-09-03,5,Very user friendly interface Surprisingly fast turnaround
1160,trust_pilot,2025-09-03,5,Satisfying Peace of mind Help with billing and costs
1161,trust_pilot,2025-09-03,2,Website did not work Bounced back to homepage six times during claims process
1162,trust_pilot,2025-09-03,4,Great product Helps dog stay healthy
1163,trust_pilot,2025-09-03,5,4 paws up Tried pet insurance Dog needed ACL surgery Embrace covered quickly without hassle Sold and recommends
1164,trust_pilot,2025-09-03,5,Reimbursement without fight Insured three dogs First claim 7 to 10 days Subsequent claims quick sometimes same or next day Peace of mind Highly recommend
1165,google_play,2025-10-20,1,Constantly crashes
1166,google_play,2025-10-17,3,Convenient but UI needs work Keyboard covers fields when filling out claims
1167,google_play,2025-10-17,1,Do not sign up for wellness plan Accuses bait and switch Using wellness rewards incorrectly
1168,google_play,2025-10-15,4,Process is simple
1169,google_play,2025-10-15,1,App update keeps freezing and closing
1170,google_play,2025-10-14,4,Quick easy painless claim submission Waiting on reimbursement
1171,google_play,2025-10-13,1,Very buggy
1172,google_play,2025-10-08,5,Very user friendly
1173,google_play,2025-10-07,1,App is garbage Slow and crashes constantly Even on new phone
1174,google_play,2025-10-01,5,Great customer service Very helpful
1175,google_play,2025-09-29,3,App not working Could not update address or direct deposit Update Had great experience with representative
1176,google_play,2025-09-28,3,Never used this app
1177,google_play,2025-09-27,5,Excellent company
1178,google_play,2025-09-25,1,Crashes all the time Signs you out Worst app
1179,google_play,2025-09-24,3,No app logo on Pixel 10 Pro App otherwise works
1180,google_play,2025-09-24,1,The app never works
1181,google_play,2025-09-24,1,App so buggy it feels intentional Prevents claim submission
1182,google_play,2025-09-23,5,Pleasant courteous knowledgeable care team
1183,google_play,2025-09-20,5,Timely responses Answers all questions
1184,google_play,2025-09-19,5,Claims easy to submit and handled quickly
1185,google_play,2025-09-19,1,Keeps crashing
1186,google_play,2025-09-19,1,App unstable and force closes
1187,google_play,2025-09-18,5,Only insurance Well worth it Loves Embrace
1188,google_play,2025-09-17,5,Easy claim filing process
1189,google_play,2025-09-15,1,Does not work on iPhone or Android Cannot enter total amount
1190,google_play,2025-09-14,1,App crashes when searching for vet office
1191,google_play,2025-09-11,1,Crashes every time
1192,google_play,2025-09-10,1,Do not get insurance Claims denied despite paperwork
1193,google_play,2025-09-09,4,Good pet insurance through auto insurance company
1194,google_play,2025-09-09,1,App keeps crashing on Google Pixel phones
1195,google_play,2025-09-08,5,They help me with my dog
1196,google_play,2025-09-06,3,Sent bill copy and contact info for more details
1197,google_play,2025-09-05,1,Fix the app Many bugs
1198,google_play,2025-09-01,5,Worth it Highly recommend
1199,google_play,2025-08-28,1,Slow buggy crashes Cannot upload PDFs No email support
1200,google_play,2025-08-27,3,Was great when pet was alive No longer uses app
1201,google_play,2025-08-26,1,Worst apps No option to attach documents Dropdown issues
1202,google_play,2025-08-26,1,Cannot submit claim without crashing
1203,google_play,2025-08-24,1,Used to be great Now crashes at login Unusable
1204,google_play,2025-08-23,3,Company great App crashes Took multiple tries
1205,google_play,2025-08-21,5,Easy sign up Great coverage for low cost
1206,google_play,2025-08-20,2,Confusing app Diagnosis issues Editing problems
1207,google_play,2025-08-20,5,Very easy to deal with Fast
1208,google_play,2025-08-20,1,App keeps crashing
1209,google_play,2025-08-20,2,Company okay App terrible Login broken Document upload painful
1210,google_play,2025-08-17,5,Easy to use and rewarding for pet owners
1211,google_play,2025-08-16,2,Loves company Hates app Logs out Cannot type fields
1212,google_play,2025-08-14,2,Company great App unusable Sign in issues
1213,google_play,2025-08-14,5,Very convenient
1214,google_play,2025-08-12,3,App not responding during claim Must restart
1215,google_play,2025-08-11,5,Easy to file claims Usually quick payment
1216,google_play,2025-08-08,3,Insurance good App lacks PDF upload Cannot cancel online
1217,google_play,2025-08-07,5,Easy to file claim
1218,google_play,2025-08-04,5,Great experience Peace of mind No major claims yet
1219,google_play,2025-08-04,5,Great service Very happy
1245,google_review,2025-11-01,5,I was referred to Embrace through USAA and I was very satisfied with my experience with them. My counselor Hannah was very helpful friendly and knowledgeable and I feel confident I made the right choice.
1246,google_review,2025-11-02,5,I was very impressed with their customer service person who took the time to explain how coverage works and answered all my questions.
1247,google_review,2025-11-03,5,Always great customer service.
1248,google_review,2025-11-04,2,Claim processing has been easy but I am extremely disappointed in the sharp increases in premiums year after year.
1249,google_review,2025-11-05,5,So far so good. The process seems clear and easy even though my claim is still in review.
1250,google_review,2025-11-06,5,I have been a customer for years and they have great service great coverage and a very user friendly app.
1251,google_review,2025-11-07,5,Embrace has been wonderful. No problems ever and claims are handled quickly.
1252,google_review,2025-11-08,2,They kept requesting a legible invoice even after I sent it multiple times and my vet resent it as well.
1253,google_review,2025-11-09,3,Pretty good coverage options but payout times need improvement. Waiting over 30 days is too long.
1254,google_review,2025-11-10,3,The quote was competitive but I chose another insurer due to location and nearby vet coverage.
1255,google_review,2025-11-11,4,After submitting all medical records I finally got reimbursed. I wish I had chosen a better policy.
1256,google_review,2025-11-12,5,I was impressed by how fast my claim was processed and how simple the reimbursement process was.
1257,google_review,2025-11-13,2,Could not get anyone to answer the phone and was on hold for over ten minutes.
